{
  "$schema": "https://specdrift.dev/schemas/claims.schema.json",
  "schema_version": "1.0",
  "tool": "specdrift extract",
  "extracted_at": "2026-06-11T13:27:04.435Z",
  "sources": [
    {
      "file": "spec.md",
      "hash": "67210e7eced7b5b3ad4130fc57cf9fb9467af071b67c9dc1c9fba20a9f1908e3",
      "line_count": 68
    }
  ],
  "claims": [
    {
      "claim_id": "claim_001",
      "source_file": "spec.md",
      "source_hash": "67210e7eced7b5b3ad4130fc57cf9fb9467af071b67c9dc1c9fba20a9f1908e3",
      "source_line_start": 5,
      "source_line_end": 5,
      "source_text": "Build a small WordPress shortcode MVP that lets a visitor submit a generic intake request and immediately receive a visible reference number and next-step status without a page reload.",
      "section_path": [
        "MVP Specification: Generic WordPress Intake Shortcode",
        "Product Goal"
      ],
      "claim_type": "ui",
      "strength": "context",
      "binding_status": "context_only",
      "contract_candidate": false,
      "risk_tags": [
        "user_experience"
      ],
      "evidence_candidates": [
        "browser_evidence",
        "practical_test"
      ],
      "requires_human_confirmation": false
    },
    {
      "claim_id": "claim_002",
      "source_file": "spec.md",
      "source_hash": "67210e7eced7b5b3ad4130fc57cf9fb9467af071b67c9dc1c9fba20a9f1908e3",
      "source_line_start": 9,
      "source_line_end": 9,
      "source_text": "WordPress plugin.",
      "section_path": [
        "MVP Specification: Generic WordPress Intake Shortcode",
        "Format"
      ],
      "claim_type": "context",
      "strength": "context",
      "binding_status": "context_only",
      "contract_candidate": false,
      "risk_tags": [],
      "evidence_candidates": [
        "human_review"
      ],
      "requires_human_confirmation": false
    },
    {
      "claim_id": "claim_003",
      "source_file": "spec.md",
      "source_hash": "67210e7eced7b5b3ad4130fc57cf9fb9467af071b67c9dc1c9fba20a9f1908e3",
      "source_line_start": 10,
      "source_line_end": 10,
      "source_text": "Shortcode: `[example_intake]`.",
      "section_path": [
        "MVP Specification: Generic WordPress Intake Shortcode",
        "Format"
      ],
      "claim_type": "ui",
      "strength": "context",
      "binding_status": "context_only",
      "contract_candidate": false,
      "risk_tags": [
        "user_experience"
      ],
      "evidence_candidates": [
        "browser_evidence",
        "practical_test"
      ],
      "requires_human_confirmation": false
    },
    {
      "claim_id": "claim_004",
      "source_file": "spec.md",
      "source_hash": "67210e7eced7b5b3ad4130fc57cf9fb9467af071b67c9dc1c9fba20a9f1908e3",
      "source_line_start": 11,
      "source_line_end": 11,
      "source_text": "The shortcode app must render as a focused fullscreen application surface.",
      "section_path": [
        "MVP Specification: Generic WordPress Intake Shortcode",
        "Format"
      ],
      "claim_type": "ui",
      "strength": "must",
      "binding_status": "needs_confirmation",
      "contract_candidate": true,
      "risk_tags": [
        "binding_requirement",
        "user_experience"
      ],
      "evidence_candidates": [
        "browser_evidence",
        "contract_review",
        "practical_test"
      ],
      "requires_human_confirmation": true
    },
    {
      "claim_id": "claim_005",
      "source_file": "spec.md",
      "source_hash": "67210e7eced7b5b3ad4130fc57cf9fb9467af071b67c9dc1c9fba20a9f1908e3",
      "source_line_start": 12,
      "source_line_end": 12,
      "source_text": "Theme header, footer, page title, and common block-theme chrome must be hidden while the app is active.",
      "section_path": [
        "MVP Specification: Generic WordPress Intake Shortcode",
        "Format"
      ],
      "claim_type": "ui",
      "strength": "must",
      "binding_status": "needs_confirmation",
      "contract_candidate": true,
      "risk_tags": [
        "binding_requirement",
        "user_experience"
      ],
      "evidence_candidates": [
        "browser_evidence",
        "contract_review",
        "practical_test"
      ],
      "requires_human_confirmation": true
    },
    {
      "claim_id": "claim_006",
      "source_file": "spec.md",
      "source_hash": "67210e7eced7b5b3ad4130fc57cf9fb9467af071b67c9dc1c9fba20a9f1908e3",
      "source_line_start": 13,
      "source_line_end": 13,
      "source_text": "No build pipeline, no external APIs, no database persistence for the MVP.",
      "section_path": [
        "MVP Specification: Generic WordPress Intake Shortcode",
        "Format"
      ],
      "claim_type": "technical_must",
      "strength": "context",
      "binding_status": "needs_confirmation",
      "contract_candidate": true,
      "risk_tags": [
        "technical_mechanism"
      ],
      "evidence_candidates": [
        "architecture_review",
        "unit_or_integration_test"
      ],
      "requires_human_confirmation": true
    },
    {
      "claim_id": "claim_007",
      "source_file": "spec.md",
      "source_hash": "67210e7eced7b5b3ad4130fc57cf9fb9467af071b67c9dc1c9fba20a9f1908e3",
      "source_line_start": 17,
      "source_line_end": 17,
      "source_text": "Visitor: submits a request and wants immediate confirmation.",
      "section_path": [
        "MVP Specification: Generic WordPress Intake Shortcode",
        "Target Users"
      ],
      "claim_type": "feature",
      "strength": "context",
      "binding_status": "context_only",
      "contract_candidate": false,
      "risk_tags": [],
      "evidence_candidates": [
        "practical_test"
      ],
      "requires_human_confirmation": false
    },
    {
      "claim_id": "claim_008",
      "source_file": "spec.md",
      "source_hash": "67210e7eced7b5b3ad4130fc57cf9fb9467af071b67c9dc1c9fba20a9f1908e3",
      "source_line_start": 18,
      "source_line_end": 18,
      "source_text": "Internal reviewer: only represented by the status copy in this MVP, no admin UI required.",
      "section_path": [
        "MVP Specification: Generic WordPress Intake Shortcode",
        "Target Users"
      ],
      "claim_type": "ui",
      "strength": "must",
      "binding_status": "needs_confirmation",
      "contract_candidate": true,
      "risk_tags": [
        "binding_requirement",
        "user_experience"
      ],
      "evidence_candidates": [
        "browser_evidence",
        "contract_review",
        "practical_test"
      ],
      "requires_human_confirmation": true
    },
    {
      "claim_id": "claim_009",
      "source_file": "spec.md",
      "source_hash": "67210e7eced7b5b3ad4130fc57cf9fb9467af071b67c9dc1c9fba20a9f1908e3",
      "source_line_start": 22,
      "source_line_end": 22,
      "source_text": "Hero area with product label \"Example Product\" and title \"Intake Request\".",
      "section_path": [
        "MVP Specification: Generic WordPress Intake Shortcode",
        "Required UI"
      ],
      "claim_type": "context",
      "strength": "context",
      "binding_status": "context_only",
      "contract_candidate": false,
      "risk_tags": [],
      "evidence_candidates": [
        "human_review"
      ],
      "requires_human_confirmation": false
    },
    {
      "claim_id": "claim_010",
      "source_file": "spec.md",
      "source_hash": "67210e7eced7b5b3ad4130fc57cf9fb9467af071b67c9dc1c9fba20a9f1908e3",
      "source_line_start": 23,
      "source_line_end": 23,
      "source_text": "Form fields:",
      "section_path": [
        "MVP Specification: Generic WordPress Intake Shortcode",
        "Required UI"
      ],
      "claim_type": "ui",
      "strength": "context",
      "binding_status": "context_only",
      "contract_candidate": false,
      "risk_tags": [
        "user_experience"
      ],
      "evidence_candidates": [
        "browser_evidence",
        "practical_test"
      ],
      "requires_human_confirmation": false
    },
    {
      "claim_id": "claim_011",
      "source_file": "spec.md",
      "source_hash": "67210e7eced7b5b3ad4130fc57cf9fb9467af071b67c9dc1c9fba20a9f1908e3",
      "source_line_start": 24,
      "source_line_end": 24,
      "source_text": "Name.",
      "section_path": [
        "MVP Specification: Generic WordPress Intake Shortcode",
        "Required UI"
      ],
      "claim_type": "context",
      "strength": "context",
      "binding_status": "context_only",
      "contract_candidate": false,
      "risk_tags": [],
      "evidence_candidates": [
        "human_review"
      ],
      "requires_human_confirmation": false
    },
    {
      "claim_id": "claim_012",
      "source_file": "spec.md",
      "source_hash": "67210e7eced7b5b3ad4130fc57cf9fb9467af071b67c9dc1c9fba20a9f1908e3",
      "source_line_start": 25,
      "source_line_end": 25,
      "source_text": "E-Mail.",
      "section_path": [
        "MVP Specification: Generic WordPress Intake Shortcode",
        "Required UI"
      ],
      "claim_type": "data",
      "strength": "context",
      "binding_status": "needs_confirmation",
      "contract_candidate": true,
      "risk_tags": [
        "compliance"
      ],
      "evidence_candidates": [
        "compliance_review",
        "data_schema_review"
      ],
      "requires_human_confirmation": true
    },
    {
      "claim_id": "claim_013",
      "source_file": "spec.md",
      "source_hash": "67210e7eced7b5b3ad4130fc57cf9fb9467af071b67c9dc1c9fba20a9f1908e3",
      "source_line_start": 26,
      "source_line_end": 26,
      "source_text": "Kategorie with at least three options.",
      "section_path": [
        "MVP Specification: Generic WordPress Intake Shortcode",
        "Required UI"
      ],
      "claim_type": "context",
      "strength": "context",
      "binding_status": "context_only",
      "contract_candidate": false,
      "risk_tags": [],
      "evidence_candidates": [
        "human_review"
      ],